{
  "id": "co:resource-turn:esp32-cam-runtime:002",
  "kind": "resource_turn",
  "host": {
    "domain": "hardware_fleet",
    "object_ref": "esp32-cam-node-bundle",
    "authority_ref": "inventory"
  },
  "address": {
    "blocked_ref": "project:spatial-perception-mesh",
    "gap": "Known power path exists but continuous operation is not yet proven.",
    "desired_capability": "One ESP32-CAM node can run continuously on the verified power path."
  },
  "contract_ref": "/confluence/resource-turn/resource-turn.contract.json",
  "state": "held",
  "hold": {
    "move": "verify",
    "candidate_ref": "inventory:verified-esp32-cam-power-path",
    "already_have_refs": ["inventory:esp32-cam", "inventory:verified-power-path"],
    "cost_vector_ref": null,
    "adoption_proof": "One ESP32-CAM runs for 24 hours without brownout."
  },
  "evidence_refs": [],
  "return": {
    "status": "pending",
    "capability_delta": null,
    "unlocked_refs": [],
    "return_address": "project:spatial-perception-mesh"
  }
}
